{
  "description": "Unit conversion factors and standard definitions",
  "version": "2.0.0",
  "last_updated": "2024-10-29",

  "memory_units": {
    "description": "Memory and storage unit conversions",
    "note": "Two standards exist: binary (base-1024, IEC standard) and decimal (base-1000, SI standard). Computer memory typically uses binary, while storage manufacturers often use decimal.",
    
    "bytes_to_bits": 8,
    
    "binary_units": {
      "description": "Binary units (IEC 60027-2 standard, base-1024)",
      "kibibyte": {
        "bytes": 1024,
        "bits": 8192,
        "abbreviation": "KiB",
        "alternative_abbreviation": "KB (ambiguous)",
        "notes": "2^10 bytes. Often incorrectly labeled as KB."
      },
      "mebibyte": {
        "bytes": 1048576,
        "kibibytes": 1024,
        "abbreviation": "MiB",
        "alternative_abbreviation": "MB (ambiguous)",
        "notes": "2^20 bytes"
      },
      "gibibyte": {
        "bytes": 1073741824,
        "mebibytes": 1024,
        "abbreviation": "GiB",
        "alternative_abbreviation": "GB (ambiguous)",
        "notes": "2^30 bytes. RAM capacity uses this standard."
      },
      "tebibyte": {
        "bytes": 1099511627776,
        "gibibytes": 1024,
        "abbreviation": "TiB",
        "alternative_abbreviation": "TB (ambiguous)",
        "notes": "2^40 bytes"
      },
      "pebibyte": {
        "bytes": 1125899906842624,
        "tebibytes": 1024,
        "abbreviation": "PiB",
        "notes": "2^50 bytes"
      }
    },
    
    "decimal_units": {
      "description": "Decimal units (SI standard, base-1000)",
      "kilobyte": {
        "bytes": 1000,
        "bits": 8000,
        "abbreviation": "kB",
        "alternative_abbreviation": "KB (ambiguous)",
        "notes": "10^3 bytes. Storage manufacturers typically use this."
      },
      "megabyte": {
        "bytes": 1000000,
        "kilobytes": 1000,
        "abbreviation": "MB",
        "notes": "10^6 bytes"
      },
      "gigabyte": {
        "bytes": 1000000000,
        "megabytes": 1000,
        "abbreviation": "GB",
        "notes": "10^9 bytes. Hard drive/SSD capacity uses this standard."
      },
      "terabyte": {
        "bytes": 1000000000000,
        "gigabytes": 1000,
        "abbreviation": "TB",
        "notes": "10^12 bytes"
      },
      "petabyte": {
        "bytes": 1000000000000000,
        "terabytes": 1000,
        "abbreviation": "PB",
        "notes": "10^15 bytes"
      }
    },
    
    "common_confusion": {
      "description": "Why your 1TB drive shows as 931GB",
      "example": "1 TB (decimal) = 1,000,000,000,000 bytes = 931.32 GiB (binary)",
      "calculation": "1,000,000,000,000 ÷ 1,073,741,824 = 931.32",
      "explanation": "Manufacturers use decimal (1000^4), OS displays binary (1024^3)"
    }
  },

  "performance_units": {
    "description": "Performance metric conversions",
    
    "flops_hierarchy": {
      "description": "Floating Point Operations Per Second",
      "flops": {
        "value": 1,
        "abbreviation": "FLOPS",
        "description": "Base unit"
      },
      "kiloflops": {
        "flops": 1000,
        "abbreviation": "KFLOPS",
        "notes": "10^3 FLOPS"
      },
      "megaflops": {
        "flops": 1000000,
        "kiloflops": 1000,
        "abbreviation": "MFLOPS",
        "notes": "10^6 FLOPS"
      },
      "gigaflops": {
        "flops": 1000000000,
        "megaflops": 1000,
        "abbreviation": "GFLOPS",
        "notes": "10^9 FLOPS"
      },
      "teraflops": {
        "flops": 1000000000000,
        "gigaflops": 1000,
        "abbreviation": "TFLOPS",
        "notes": "10^12 FLOPS. Modern consumer GPUs range from 10-40 TFLOPS FP32."
      },
      "petaflops": {
        "flops": 1000000000000000,
        "teraflops": 1000,
        "abbreviation": "PFLOPS",
        "notes": "10^15 FLOPS. Supercomputer performance metric."
      },
      "exaflops": {
        "flops": 1000000000000000000,
        "petaflops": 1000,
        "abbreviation": "EFLOPS",
        "notes": "10^18 FLOPS. Frontier supercomputer achieved this in 2022."
      }
    },
    
    "other_performance_metrics": {
      "mips": {
        "description": "Million Instructions Per Second",
        "abbreviation": "MIPS",
        "notes": "CPU performance metric, varies by instruction mix. Less commonly used today."
      },
      "ipc": {
        "description": "Instructions Per Cycle",
        "abbreviation": "IPC",
        "notes": "Measure of CPU efficiency. Modern CPUs achieve 3-5 IPC on average workloads."
      },
      "iops": {
        "description": "Input/Output Operations Per Second",
        "abbreviation": "IOPS",
        "notes": "Storage performance metric. NVMe SSDs: 100K-1M+ IOPS, HDDs: 100-200 IOPS."
      },
      "tokens_per_second": {
        "description": "LLM inference speed",
        "abbreviation": "tok/s",
        "notes": "Generation speed for language models. Context-dependent."
      }
    }
  },

  "bandwidth_units": {
    "description": "Data transfer rate conversions",
    
    "bit_rates": {
      "description": "Network bandwidth (typically bits per second)",
      "kilobits_per_second": {
        "bits_per_second": 1000,
        "bytes_per_second": 125,
        "abbreviation": "kbps or Kbps"
      },
      "megabits_per_second": {
        "bits_per_second": 1000000,
        "bytes_per_second": 125000,
        "abbreviation": "Mbps",
        "notes": "Common for internet speeds. 100 Mbps = 12.5 MB/s"
      },
      "gigabits_per_second": {
        "bits_per_second": 1000000000,
        "bytes_per_second": 125000000,
        "megabits_per_second": 1000,
        "abbreviation": "Gbps",
        "notes": "Network interface speeds. 1 Gbps Ethernet = 125 MB/s theoretical"
      },
      "terabits_per_second": {
        "bits_per_second": 1000000000000,
        "gigabits_per_second": 1000,
        "abbreviation": "Tbps",
        "notes": "High-speed datacenter interconnects"
      }
    },
    
    "byte_rates": {
      "description": "Storage/memory bandwidth (typically bytes per second)",
      "megabytes_per_second": {
        "bytes_per_second": 1000000,
        "bits_per_second": 8000000,
        "abbreviation": "MB/s",
        "notes": "Common for storage throughput"
      },
      "gigabytes_per_second": {
        "bytes_per_second": 1000000000,
        "megabytes_per_second": 1000,
        "bits_per_second": 8000000000,
        "abbreviation": "GB/s",
        "notes": "Memory bandwidth. DDR5-6400 = 51.2 GB/s per channel"
      },
      "terabytes_per_second": {
        "bytes_per_second": 1000000000000,
        "gigabytes_per_second": 1000,
        "abbreviation": "TB/s",
        "notes": "High-end GPU memory bandwidth. H100 HBM3: ~3 TB/s"
      }
    },
    
    "common_interfaces": {
      "description": "Standard interface speeds",
      "usb_2_0": {
        "theoretical_mbps": 480,
        "theoretical_MBps": 60,
        "practical_MBps": "30-40"
      },
      "usb_3_0": {
        "theoretical_gbps": 5,
        "theoretical_MBps": 625,
        "practical_MBps": "300-400"
      },
      "usb_3_1_gen2": {
        "theoretical_gbps": 10,
        "theoretical_MBps": 1250,
        "practical_MBps": "800-1000"
      },
      "usb_4": {
        "theoretical_gbps": 40,
        "theoretical_MBps": 5000,
        "notes": "Same speed as Thunderbolt 3/4"
      },
      "sata_3": {
        "theoretical_gbps": 6,
        "theoretical_MBps": 600,
        "practical_MBps": "500-550"
      },
      "pcie_3_0_x4": {
        "theoretical_GBps": 3.94,
        "practical_GBps": "3.0-3.5",
        "notes": "Common for NVMe SSDs"
      },
      "pcie_4_0_x4": {
        "theoretical_GBps": 7.88,
        "practical_GBps": "6.0-7.0",
        "notes": "Modern NVMe SSDs"
      },
      "pcie_5_0_x4": {
        "theoretical_GBps": 15.75,
        "practical_GBps": "12.0-14.0",
        "notes": "Latest NVMe SSDs (2024)"
      },
      "ethernet_1g": {
        "theoretical_mbps": 1000,
        "theoretical_MBps": 125,
        "practical_MBps": "110-118"
      },
      "ethernet_10g": {
        "theoretical_gbps": 10,
        "theoretical_MBps": 1250,
        "practical_MBps": "1150-1200"
      }
    }
  },

  "power_units": {
    "description": "Power and energy conversions",
    
    "power": {
      "watt": {
        "description": "Unit of power (energy per unit time)",
        "abbreviation": "W",
        "formula": "1 W = 1 J/s"
      },
      "kilowatt": {
        "watts": 1000,
        "abbreviation": "kW",
        "notes": "10^3 watts"
      },
      "megawatt": {
        "watts": 1000000,
        "kilowatts": 1000,
        "abbreviation": "MW",
        "notes": "10^6 watts. Large datacenter power draw."
      },
      "horsepower": {
        "watts": 745.7,
        "abbreviation": "hp",
        "notes": "Mechanical horsepower. 1 hp ≈ 746 W"
      }
    },
    
    "energy": {
      "joule": {
        "description": "SI unit of energy",
        "watt_seconds": 1,
        "abbreviation": "J",
        "notes": "1 joule = 1 watt-second"
      },
      "watt_hour": {
        "joules": 3600,
        "watt_seconds": 3600,
        "abbreviation": "Wh"
      },
      "kilowatt_hour": {
        "watt_hours": 1000,
        "joules": 3600000,
        "megajoules": 3.6,
        "abbreviation": "kWh",
        "notes": "Standard unit for electricity billing"
      },
      "megawatt_hour": {
        "kilowatt_hours": 1000,
        "joules": 3600000000,
        "abbreviation": "MWh",
        "notes": "Large-scale energy measurement"
      },
      "calorie": {
        "joules": 4.184,
        "abbreviation": "cal",
        "notes": "Small calorie (thermochemical)"
      },
      "kilocalorie": {
        "joules": 4184,
        "calories": 1000,
        "abbreviation": "kcal or Cal",
        "notes": "Food calorie. 1 Cal (food) = 1 kcal = 1000 cal"
      },
      "btu": {
        "joules": 1055.06,